"","klasifikasi","score","text"
"822","Positif",4,"impian banget sih mudahan     yg  bikin cergam  jd film  series animasi  apapun deh yg mediumnya  populer biar cerita adaptasi wayang modern sebagus   ditemuin  orang duh asli impian banget "
"823","Negatif",-1,"tanyakanrl kulineran  pasar gede nonton wayang orang  sriwedari keliling pasar triwindu keknya seru"
"824","Negatif",-1," tgk documentary nct dream ni  taylor   menangis   wayang"
"825","Negatif",-1,"bosan la   nk tgk wayang  syifaa takdeee "
"826","Netral",0,"jadwal wayang desember "
"827","Negatif",-2,"bru lepas tgk qodrat kt wayangrasa mcm tgk cter munafik "
"828","Negatif",-1,"jefrinichol heeuh apal inget ceuk dadan sunandar sunarya keur naon jeung nanaonan kajeung nonton wayang ayeuna mah bae  kuno ge"
"829","Negatif",-1,"cont    percaya alkisah puan  wayang hwangbo   semalam berubah total  semestinya kepercayaannya   sosok manusia     arus sungai menyeret sarira  tersasar  kota  cont"
"830","Negatif",-1,"bye nak pakai baju kurung pi tengk wayang"
"831","Netral",0,"eh kejap suju documentary on disneyplus  so takde  cinema  eh   nak yeayyeay pi tengok  wayang alaaaaaaaaaaaaaaa"
"832","Negatif",-2,"besok plan wayang and cari  llao llao  dye  tu  sedih bai mood"
"833","Netral",0," tau pulak nct dream  movie kat wayang"
"834","Negatif",-2,"atkhrahim pegi shopping mall tgok wayang ok  jalan jalan  shopping mall sahaje"
"835","Negatif",-1," missions today beli kek lapis  pergi tengok wayang  get to airport in time"
"836","Netral",0,"kaesangp  doa  semoga acara pernikahan lancar sukses mas kaesang hiburan wayang kulit  dangdut koplo ramai  nya "
"837","Netral",0,"tanamfess iya wayang emang  matahari yg   kalo ditempat adem    kyk hibernasi gitu  wayangku kali hibernasi"
"838","Positif",1,"nurulashikinm dorg nak serang kat twiter tu dorang  pasal layang korang  hbs meroyan pasal  tu lalain kali srg parti korg knp  terima cadangan ydpa utk membentuk kerajaan skrg ni kerajaan dh ditubuhkan releks  lakau    politik ni wayang penuh sandiwara"
"839","Negatif",-1,"penulisrebel hendrowibowoyza detikcom indo emng paradoks modal mak   jd ketua dpr modal masuk goronggorong  jdi presiden pdhl gagasan gk  ide zonk planga plongo  pemimpin  dlihat dr pemikirannya  bkn kaya wayang yg hrus d arahin   dalang"
"840","Netral",0,"noonafanscoups wayang la  best ohhhala lps exam pi la tgk"
"841","Netral",0,"nyesal pulak masuk alam shah   mesti  dah menteri  wakakakak  so far takde sbp  lawan location alam shah bai korang ade  tengok transformer kat wayang the st day airing "
"842","Negatif",-2," bupati   wakil bupati   dpr ri komisi ix   kepala bpmi beserta forkopimda menghadiri pagelaran wayang kulit  rangka memperingati  pekerja migran internasional dalang ki sigit ariyanto  alunalun purwodadi jumat desember "
"843","Netral",0,"dprd dij gelar wayang kulit semar mbangun kayangan "
"844","Netral",0,"babinsa kadipaten hadiri pementasan wayang kulit semar mbangun khayangan "
"845","Netral",0,"bertarafmenteri kiridaren jawatan wayang je  tpm"
"846","Negatif",-1,"silliestrat yee sbb ni musim politik je ni  time teganu  wayang gitu tkx pulok org luor nk complain okay je  tkx isu"
"847","Negatif",-3,"fmtoday  timbalan menteri ramai  orang dap  payah nak main wayang     pulak menteri india    orang india   bising  cabinet pm  bijaksana tau  perpaduan maaah"
"848","Negatif",-3,"ijoewithdash some more tengok wayang asing asing okay pe i mean pergi tengok sorang  takde   asing laki puan deme  triggered lmao"
"849","Negatif",-1,"tanyarlfes putri  wayang  bat gak tuh "
"850","Positif",1,"cerita ni  skrip nama alif yaa sesuai  ni member ajak wayang cerita ni "
"851","Netral",0,"ayah pemain wayang kulit hehe "
"852","Negatif",-1,"pagelaran wayang kulit dlm rangka  pekerja migran internasional  dalang ki sigit ariyanto dgn lakon wahyu nugroho jati  alunalun purwodadi dihadiri bupati groboganwakil bupati grobogankepala bpmi anggota dpr riforkopimdadan kepala disnakertrans "
"853","Positif",1,"simbokdharmi tokoh    mengenal     rajin nonton wayang  gong"
"854","Negatif",-1,"dalange aleman   maunya  ojo lali sabtu sore nonton sinden ngetrend tvrijawatengah ya  sindenngetrend tvrijateng sindenwayang wayangkulit tembangjawa gamelanjawa dalangwayang dagelan guyonan murubibudayajawa "
"855","Netral",0," ni wayang  serious  haha"
"856","Negatif",-2,"pesanan karna wayang ga   klo ga  gerakin dalang "
"857","Netral",0,"tayangan wakanda dah abis ka kat wayangxdan nak tgok mart "
"858","Negatif",-1,"wkwkwk  tuh wayang versi jawa  india tuh beda sih    something story that missing gitu  "
"859","Positif",1,"alharkan podo sakjane  bagus kiri kyk kesan aksara jawa soale sek trngsh rads over modern aksen jawane  gunung  huruf l yg kyk wayang gunung sek kanan  islami "
"860","Negatif",-1,"alhamdulillah   pergi rumah orang kawen okey dah  makan  tengok drama  wayang   kat malaysia ni  "
"861","Negatif",-1," presiden  panggung wayang orang  senen "
"862","Negatif",-1,"isyafiqkyle  rajinpergi tengok wayang  malas dok  bilik je"
"863","Positif",1,"boyfriend grad   pergi tengok wayang mmg bijak"
"864","Netral",0,"babinsa kadipaten hadiri pementasan wayang kulit semar mbangun khayangan "
"865","Netral",0,"ladybugg bln  tu    bulih jugak wayang kuatsapa yg  habissan  nak bawak  makamah"
"866","Netral",0,"babinsa koramilbambanglipuro sertu dwi sujarotun menghadiri undangan acara pagelaran wayang kulit  pendopo kalurahan mulyodadi "
"867","Negatif",-2," mintak  sepang ni   panggung wayang  nak mencari hiburan sezarah panggung wayang kena pi ioi city mall putrajaya yg mengambil  minit   nak mintak on lampu je cari solution  banjir    banjir dah  de  diam la pulak"
"868","Negatif",-1,"anassnabell  wayang takleh jerit org marah"
"869","Negatif",-1,"gengsi nelpon abg  nelpon  mamak galau abg  wayang  pisah kk "
"870","Netral",0,"muhddzulazmi panggung wayang"
"871","Positif",1,"democrazymedia ngak  prestasi  kalo wayanggimana dalangprestasi keruk kekayaan alam  turunan"
"872","Negatif",-3,"andiiryant gibrantweet   dah bener pikiran   kek simbol wayang yg gunung   kek khas jawawayang  terbelokan pikiran ku  reply an mu sehat sehat mata"
"873","Positif",1,"  kenal anwar  dah   sokong   lepas  salam tangan kagum  semangat reformasi     ni wayang   kuasa   konflik  diasebabtu  dah  sokong  malaysia hancing kahkah demipertiwi"
"874","Netral",0," lahir  chester  tanggal agustus zen satusatunya anak  wayang  arsitek dunia troy sebastian  fashion designer alexia james "
"875","Positif",1,"abg grab ni sumpah slow wehhhh  mmg taksempat   nak tgok wayang cemni allahu"
"876","Netral",0,"mkinibm hope tzafrulaziz    negaramiti tu    wayang"
"877","Netral",0," gak  angst bgt sih  ku  te nya kembar  sedih sih kemarin gue nangisin mas wayang  tenang happy end  "
"878","Negatif",-1,"  nonton wayang orang  versi thailand lv"
"879","Netral",0,"numanmazlan end up   wayang  "
"880","Positif",2,"solo identik  wayang  pemenangnya yg menggambarkan gunungan  yg keblinger logo halal  g   wayang gunungan yg simbol jawa "
"881","Negatif",-1," missions today beli kek lapis  pergi tengok wayang get to airport in time"
"882","Netral",0,"  kau nmpk  sbb ahli politik rakyat berpecah belah ahli politik rilek je minum teh bleh duduk semeja kau bergaduh   peduli  diaorg as long as they have the power to themselves kau  bleh  pape pon wayang je depa  ni"
"883","Netral",0,"dzaqura ni   wayang ni disney movie mins je scene ni mins je actually haha"
"884","Netral",0,"maxxwu huhuhu dah   tengok wayang "
"885","Negatif",-3,"tanyakanrl kalo yg  gue emang ngerasa aneh sih karna ga kenal  tp kalo bio one gue ngerasa  aja karna ga asing liat cowo crossdress pake kebaya kaya didik nini towok  yg  hamzah batik  kalo  pagelaran wayang  kadang suka "
"886","Positif",1,"wowziq arish sukareplytweet arshadalfie pittssuda anwaribrahim    anwar dgn zahid dah mmg plan    so yahhhh   anwar wayang kulit modal sokong penyamun tu  tarik macai "
"887","Netral",0,"rajendrarestu javassantuyaja koyo wayang gareng"
"888","Positif",1,"priyou velvetgr gibrantweet  wayang  dah tradisi  wilayah jawa  wajar kang menang"
"889","Negatif",-1,"kangl   budaya wayang dlm   yg pusing dalangnya bkn wayang"
"890","Netral",0,"bvejeno ad kt meja dkt dgn counter nk masuk wayang tu ad staff kt situ jaga"
"891","Negatif",-2,"muhammadsaewad salah  yg  senggol gerombolan elu wayang sbg alat menyebarkan tatanan adat istiadat luhur bangsa  muncul  bbrp th  aja dg dalih syariat simple sajah lu jual  borong "
"892","Negatif",-1,"pehh  nye wayang pijak semut x mati ah gini "
"893","Netral",0,"  nervous nak tengok wayang  nak pergi concert"
"894","Positif",1,"gibrantweet  menang   logo wayang nya hahahah"
"895","Negatif",-3,"ak  if kat ipoh  masuk mall  nk tgk wayang x payah masuk pon ak dh tau   dlm tu serius boring tu pasal boring je ak gigih drive jejauh jnji bkn mall dlm ipoh ni serius bosan weh total copy paste  je  "
"896","Negatif",-1,"ingatkan appointment braces tukar getah   je  kena pasang skru ni   nak jerit   wayang ni"
"897","Negatif",-1,"fitaooo pakantono wayang orang namae cepot"
"898","Netral",0,"okaylah done qada tidur jom    nak prgi tengok konsert nct  wayang"
"899","Positif",1,"ya laa kena  hmpa mmng laa yg tu  bijak yg ni  bijak klau  yg   penipu laa penunggang agama laa wayang kulit laa smua  "
"900","Netral",0," sesiapa nak ticket wayang nct dream  ni  tgv cheras selatan nak let go free"
"901","Netral",0,"jommmm wayang"
"902","Negatif",-1,"pi hantar kereta senvice  tggu mari tgk wayang jap"
"903","Negatif",-1,"uwaegy duka a info namah wayang golek ti purwadadi"
"904","Negatif",-1,"klu  awalnk g tgk wayangblackphanterwakandaevermaap la muka kuyu sbb cuaca syahdu jemata pn berat  ni "
"905","Negatif",-3,"plis iya banget kalo dapet kamar mandi full kaca auto bete walopun dapet yg kacanya diburemin   gue pas mandi berasa  pertunjukan wayang  kalo masi   yg tetep transparan tuh gue  pup  ga   ga nyaman "
"906","Negatif",-3,"aslm yb emysamsudin  org masjid tanah sy sgt berharap  masjid tanah dpt membukak mcd pd  yg  dtg nidan   cinema  dkt area masjid tanah nink pgi  tgk wayang amp beli mcd harap dpt menerima balas yb"
"907","Negatif",-1,"tanyarlfes beli kasetnya  buku setebel gaban  nntn   ceritain lengkap  klo nntn wayang  desa  mudeng krna tau crita a smpe z nya"
"908","Netral",0,"hajat bumi  lembur acara malamna wayang golek "
"909","Negatif",-2,"abrytohamba agoezmust musniumar dasar dongo  bilang presiden wayang aja takut dasar banci  anak anak lo kayak bencong semuamana  presiden  wayangtapi presiden     partai   petugas partai karna   partai bloondasar donggok"
"910","Negatif",-1,"minimeleis amik cuti   wayang kosong kehkehkeh"
"911","Positif",1,"sukareplytweet hazminabil ketaqqq sofeahjoned muhyiddinyassin    zahid tpm    titah agong patutnye zahid kena    letak syarat  dah ingkar perintah agung adakah  wayang "
"912","Positif",1,"kunci kemana   rashad bepergian  menyelesaikan pekerjaan gantungan kunci  anak  wayang   ketinggalan  kuasanya meraih sejumput syal berwarna merah jambu  desain cantik  feminin   lembar    nina "
"913","Netral",0,"askrlfess gakkk krna dr  pgn jd anak  wayang gt lho"
"914","Netral",0,"kawan nak  tiket wayang dream movie pulak dahh tau  beli haritu "
"915","Positif",2,"wayang  warisan budaya     lestarikan  wayang   mengambil nilainilai luhur budaya bangsa falsafah budaya nilainilai kebenaran nilainilai kebajikan  nilainilai kearifan prabowodanseni "
"916","Netral",0,"rini sbyfess pecinta wayang po mba"
"917","Netral",0,"saje nak kabor yg kau makan sorang shopping sorang tgk wayang sorang tu  tandanya kau tu kuat kau  special  kau nak acah introvert   kau takde personality kau takde character"
"918","Positif",1,"kerajinan wayang kulit dijadikan andalan  desa sidowarno  kecamatan wonosari klaten jawa   menarik perhatian wisatawan nusantara adadikompas "
"919","Netral",0,"pinkeutulips cosplay  wayang"
"920","Netral",0,"mxborarose gi tgk kt wayang  tu tu la rse esk la kot arini kemas umh dlu esk  nk pi tgk"
"921","Netral",0,"babinsa kadipaten hadiri pementasan wayang kulit semar mbangun khayangan "
"922","Netral",0,"rini sbyfess emng wayang ndue detective"
"923","Negatif",-1,"mxborarose minggu ni nk kena kemas rumah   ati  nk tgk wayang citer kim raewon tu aduhaii"
"924","Negatif",-1,"rini sbyfess cah loro ndue mata trus sampinge wayang ngono sii"
"925","Negatif",-1,"barwiasarireza kartarahardja      kelompok pendukungnya yg  mengharamkan wayang  pakaian adat      harapannya   kelompok pendukungnya    berbuat semena    diam  menghibahkan dananya     dki kemarin"
"926","Netral",0,"gusbaster  pertunjukan wayang"
"927","Negatif",-2,"arwahmaklampir depa wayang je  dah checkmate dah   nak     pembangkang  nak   penyokong berdatu dah slow malas nak  duit dah so  pas jelah"
"928","Positif",1,"kerajinan wayang kulit dijadikan andalan  desa sidowarno  kecamatan wonosari klaten jawa   menarik perhatian wisatawan nusantara adadikompas "
"929","Netral",0,"arwahmaklampir naratif depa nak bg kt penyokong tu kena kuat  yg wayang depa mcm tu"
"930","Netral",0,"muhyiddinyassin  je  pn  zahid   wayang je"
"931","Positif",1,"itsammmm untung la pirate   kematu jubo dlm wayang"
"932","Netral",0,"urang lir  wayang usik malik na ku dalang anu teu wasa teu wenang beureum hideung kuma dalang"
"933","Positif",1,"  nya  balita  begadang nonton wayang   ku  kerasa      nonton   pertunjukan hhh jawa "
"934","Netral",0," aja uwa     udah dewasa   bangetttt cerita apapun  perwayangan  uwa   enthusias    karna beliau karakter taracandra wira atmaja  hadir sosok pecinta wayang  ceritanya   tulis  kembangkan "
"935","Positif",1,"mariqgold bakat terpendam  dalang wayang sihhh"
"936","Negatif",-1," nak tngk wayang tpi mcm malas em"
"937","Negatif",-2,"penitimeniti kartarahardja keknya gubernur dki ga  larang tari baju wayang  tampil deh udah oon halu lg "
"938","Netral",0,"one ahhaha xpe kena layan je wayang dlu   scene menarik  gaduh tikam"
"939","Netral",0,"oiyo kene mung wayang dadi gosah anehaneh manut mawon wkwk"
"940","Netral",0,"pagelaran wayang kulit  rangka memperingati  pekerja migran internasional lakon wahyu nugraha jati dalang ki sigit ariyanto alunalun purwodadi "
"941","Negatif",-1,"stress capek  sby kaya  wayang cabut ah  mls pulang abis pulang oke malang deh  "
"942","Netral",0,"sbyfess wayang kembar  i know u meant  waaaa wkwkwk"
"943","Netral",0,"babinsa kadipaten menghadiri pementasan wayang kulit semar mbangun khayangan "
"944","Positif",4,"  situ   suka banget  wayang dirumah uwa  suka nyetel lagu jawa gamelan dll   dikasih tau   suka banget kisah ken arok  ken dedes   politik banget ceritanya   mikir  romance banget ya "
"945","Netral",0,"anyone   setia city mall jom teman i tengok wayang petang ni"
"946","Positif",1,"aizatulakz cheyatt pejaofperak hannahyeoh halaaaaaahhh menteri kat  tu takde    wayang  korang rakyat je rakyat dok gaduh  "
"947","Netral",0,"quvvatt  nonton wayang klitik "
"948","Negatif",-1,"  uwa jenong   nonton wayang  tvri  tuh  wayang tayang  malem  tvri    wc  suka kepo  nanya    bentuknya    jelasin   wayang pemerannya orang asli  ceritain   aja "
"949","Netral",0," menjual bros wayang silver et seharga rp dapatkan  shopee  "
"950","Netral",0," menjual bros wayang silver et seharga rp dapatkan  shopee  "
"951","Netral",0,"istiqom yashudhanaka plt nya wayang"
"952","Netral",0,"husnul jawafess askrlfess yaa bayangin aja kyk wayang "
"953","Netral",0,"matcabewy kn wayang   layar tancep"
"954","Negatif",-1,"danurejan jogja piket pawas aiptu wahyudi kasi humas beserta personil polsek danurejan polresta yogyakarta melaksanakan pengamanan pagelaran wayang kulit  lakonsemar bangun kayangan  ki dalang geter  halaman kantor dpr provinsi diy jl malioboro yogyakarta "
"955","Negatif",-2,"iambangman  kau tgk wayang pastu kau nangis dah   kau  pelakon   kau nangis tgk org mati ditanam dah   kau nak mati gak   say la org tu dah kawin pastu  nangis tgk anak sulung   pelamin   la  nak kawin  camtu"
"956","Netral",0,"sbyfess  wayang  kembar   wambyar"
"957","Netral",0,"nurqaseh kakak manis  reliti kehidupan sebenar yg penuh dugaan  tangisan spt termaktub didlm agama  nak sempurna didlm kehidupan fana   tgk drama  wayang nak pesan jgn cepat  melatah sabaaarrr yg  pengakhiranend  pengawalnyastart"
"958","Negatif",-2,"amri zie kaneshoff kuasasiswa dapmalaysia tu sbb  ramai  org islam kena main dgn wayang dap"
"959","Positif",1,"lizaindo maszobirin buncs salimafillah ragilsemar erickthohir kaesangp gibrantweet jokowi mangkunegaran sdh menghidupkan  wayang kulit yg rutin  sekalimonggo yg bade ningali "
"960","Negatif",-1,"pakantono kaya yg  dikarakter wayang kulit tp lupa namanya"
"961","Netral",0,"matcabewy wayang kali layar tancep"
"962","Positif",1,"sonnyiswara aremanita yudhapati sintamahalona ellenmine diajengemy valhallaah jelantik renatalevel diposurop    dalang wayang kulit  sepuh  pakem adegan  dialog   pantang    dalang    tontonan  menghibur   tuntunan  mendidik   dialognya  to the point  "
"963","Netral",0,"babinsa  bhabinkamtibmas desa kebonagung menghadiro acara pagelaran wayang kulit  dalang ki mangun yuwono bertempat   balai desa kebonagung jum "
"964","Netral",0,"urblacktea kangennn delok wayang"
"965","Netral",0,"oryxion syafaatnasir ahhahaha aik nk koyak kenape sabar jngn gnggu sy bro nk tngk wayang ni hahahhahahaha"
"966","Netral",0,"buletintv mp wayang"
"967","Netral",0,"sysafwann bookcharity vokalkita pejaofperak justintwj patut tulis kaki munajat  tgk wayang"
"968","Netral",0,"oryxion syafaatnasir ahhaha sapa cakap pn nk bgi jawatan  wak ponorogo hahahaha petik tgha kenape pulak xsentap    wayang   hahahahah"
"969","Negatif",-3,"dellmadestra meoow askrlfess klau wayang kulit pke b kromo alus ga si kak    klau nnton wayang ga mudeng   paham pas ngomong b kasarya doank hehe"
"970","Netral",0,"rini sbyfess  wayang"
"971","Netral",0,"uripe awakdewe ki koyok wayang kulit bah arep  obatabet ne sampek remok to yo iso opo dalang wes nentok ne critane awakdewe"
"972","Positif",1,"   kulit luarnya filosofi hidup  prabowo tu  bernegara kedaulatan persatuan swasembada gitugitu     masuk lihat dalamnya ya kayak  beliau  wayang diatas prabowodanseni "
"973","Negatif",-2,"  mengerti  wayang     budaya  budaya nusantara   paham  peran pewayangan    tengahtengah masyarakat  prabowodanseni "
"974","Netral",0,"doyochiw wduh  anak  wayang"
"975","Negatif",-1,"yussofi lyleez khairizulfadhli penasihat utk main wayang hmmm phm la jgk lg mendlm"
"976","Netral",0," desember gol  wayang gatot indra amankan  poin persib  menjamu psds "
"977","Positif",3,"  rugas dpm tu wayang jer  utk zh bg utk  syarat sbb pm  full power utk jalankan urusan  pentadbiran negara dibantu ahli ph yg  fokus utama skang  bgnkan  ekonomi negara  bantu rakyat"
"978","Netral",0," ni  byk la pegi tgk wayang kli bhai minion alf astu mechamato soon"
"979","Netral",0,"nak tengok wayang but takde cerita menarik hm"
"980","Negatif",-2,"  mengerti  wayang     budaya  budaya nusantara   paham  peran pewayangan    tengahtengah masyarakat  prabowodanseni "
"981","Positif",1,"pejaofperak fahakufpejaofperak ko  mb perak  bikin malu jerrrmenteri  wayang"
"982","Netral",0,"sbyfess ak  wayang cilik"
"983","Netral",0,"tvonenews gak  jokowi  bicara  iniorang lansia  orang berpendidikan rendahalias gak  ijazahpun      indonesiaapakah indonesia  dipimpin  sekelas wayang  dipimpin  sekelas dalang"
"984","Netral",0,"donjasmy shahrizalbakar edruceidrisi kuasasiswa   wayang ph dgn anwar nk bodohkan rakyat"
"985","Positif",2,"faridhazmi aizatulakz faisalmn abdulhadiawang awat  ambil gambar  tu  dah  main wayang terima kenyataan  sape yg dgn kluster mahkamah pas  tu dah tolak geng rasuah  pas  xde rasuah pn   syarat gabung dgn bn  kluster mahkamah x nak terima  bye"
"986","Netral",0," masuk mall  debit card  la    selepas  am time tu   maintenance  jem la kau kat situ   terciduk ni genggeng tengok wayang   "
"987","Negatif",-1,"lapor  polisi dibilang  acara lomba wayangdalang dll   lombanya jam   orang  tidur"
"988","Netral",0," udah   wayang golek lacung"
"989","Netral",0,"gitarizti  kek bapakku kak  cerita wayang hapal banget diluar kepala "
"990","Negatif",-2,"  mengerti  wayang     budaya  budaya nusantara   paham  peran pewayangan    tengahtengah masyarakat  prabowodanseni "
"991","Negatif",-1,"gua mikirnya  wayang trs sampingnya bocah kembar dipikir   gunung wayang  maksudnya jawa   blm dpt  trs pas baca repnya wwkwkwk anjer tugel "
"992","Netral",0,"shahmer ko tgk wayang cerita "
"993","Netral",0,"weii  confession kt wayang ok ku pelu cekbcz last month nya x klua  kt sitok and pikir nya mmg xkan klua wayang msia  huhu "
"994","Negatif",-1,"bangnobbangnob sbyfess yaampun  ngeh salah fokus  wayang"
"995","Netral",0,"menhan prabowo bersilaturahmi  presiden jokowi  keluarga  yogya ajak anak  wayang "
"996","Negatif",-4,"wayang   berbeda   identitas nasional     budayabudaya  ditinggalkan  masyarakat indonesia   kebanyakan     peduli  "
"997","Positif",2,"masingmasing   senang melestarikan budaya   kental  adatnya contohnya  orangorang jawa   antusias   pertunjukan wayang   kesenian khas jawa  sampaisampai   hafal  lakon  dipertunjukkan "
"998","Negatif",-3," anak  wayang  enak       khawatir   cibir  saudara   capek  suruhan kakak   khawatir    mendidik adik  tuntutan anak  wayang    orang tuanya"
"999","Netral",0,"xjaszmineee ye dooo  taktau camne   tengok cerita hantu kat wayang  tanak dahhhhh"
"1000","Netral",0,"marii ngisi solarr langsung mlayu plus petuk wayang wkwkwkk "
"1001","Netral",0,"ganjarpranowo cuman dijadiin wayang dalangnya  mega bati"
"1002","Negatif",-1,"rezasyariatii ekalayapemerannya otongkoil  wayang orang bukinan ariedaging"
"1003","Negatif",-2," bola makan lepas bola ngeteh kat dapur cari makan jeng doh  beradik pahtu esok tido kerah  wayang "
"1004","Netral",0,"chermeups meoow askrlfess ko yo   brasa delok wayang kulit "
"1005","Netral",0,"sbyfess   wayang"
"1006","Positif",1,"prabowodanseni    kulit luarnya filosofi hidup  prabowo tu  bernegara kedaulatan persatuan swasembada gitugitu     masuk lihat dalamnya ya kayak  beliau  wayang diatas"
"1007","Negatif",-2,"prabowodanseni   mengerti  wayang     budaya  budaya nusantara   paham  peran pewayangan    tengahtengah masyarakat "
"1008","Positif",2,"nasib   piala dunia time politik negara berwayangwayang"
"1009","Netral",0,"si   pamer  nonton wayang nyampe pagi"
"1010","Negatif",-1,"seneng gegara  lakon wayang  kampus  ga seneng  durasinya "
"1011","Netral",0,"sbyfess wayang kembar"
"1012","Netral",0,"peachyyyygurll sbyfess yo mbok ra wayang "
"1013","Netral",0,"peachyyyygurll sbyfess wayang mbahmu"
"1014","Negatif",-1,"anehnya  bs hapal cerita mahabharata dr yg versi wayang sampek yg series india   pelajaran bhs jawa  sekolah  yg topiknya ttg pewayangan langsung   kepala  "
"1015","Positif",1,"xxvnxxo sbyfess  klo pake jawa alus dibilang kyo nanggap wayang "
"1016","Netral",0,"haruhikohideo cinema bang  pas nonton wayang direview in "
"1017","Netral",0,"fazhalin noo ni belom lagiiii ni valid  pilah da  wayang ngan auntie anneee wkwkww"
"1018","Netral",0,"wayangan ah sue ora wayangan bola  marahi ecmoci wayang durmogati budayanusantara "
"1019","Netral",0," acaranya kemendes gaesss  wayang kulit jugaa  seru keknya"
"1020","Positif",1,"   kulit luarnya filosofi hidup  prabowo tu  bernegara kedaulatan persatuan swasembada gitugitu     masuk lihat dalamnya ya kayak  beliau  wayang diatas prabowodanseni "
"1021","Netral",0," kali  nonton small town heroes kat wayang ya   menang yaaaa"
"1022","Positif",3," anak muda  tetaplah mengunjungi ruang kesenian tontonlah wayang lihatlah pameran lukisan baca puisi  pujangga indonesia  apapun yg menarik kau nikmati kunjungi daerah  indah n lihat betapa sempurnanya indonesia penuh dgn keragaman indah"
"1023","Negatif",-2,"  mengerti  wayang     budaya  budaya nusantara   paham  peran pewayangan    tengahtengah masyarakat  prabowodanseni "
"1024","Positif",1,"prabowo  seni wayang   kesatuan cinta indonesia prabowo "
"1025","Netral",0,"mrunkno esok jom teman wayang  date "
"1026","Positif",1,"   kulit luarnya filosofi hidup  prabowo tu  bernegara kedaulatan persatuan swasembada gitugitu     masuk lihat dalamnya ya kayak  beliau  wayang diatas prabowodanseni "
"1027","Negatif",-2,"  mengerti  wayang     budaya  budaya nusantara   paham  peran pewayangan    tengahtengah masyarakat  prabowodanseni "
"1028","Positif",1,"seunsky untung lee  kat tapah do wayang kulit  takde"
"1029","Negatif",-2," tu  nak ubah  negara kena ubah masyarakat tu     kau ban panggung wayang kelab malam  kedai arak end up masyarakat tu  yg   cegah kemungkaran tu  semestinya ban wayang didik org    "
"1030","Netral",0,"sekedar wayang  dalang"
"1031","Netral",0,"  nak pergi tengok mechamato the movie   healing tengok wayang sensorang hahaha"
"1032","Negatif",-2,"  mengerti  wayang     budaya  budaya nusantara   paham  peran pewayangan    tengahtengah masyarakat  prabowodanseni "
"1033","Netral",0,"mnknnobody bkn  nak tgk wayang  ahhaha"
"1034","Positif",1,"   kulit luarnya filosofi hidup  prabowo tu  bernegara kedaulatan persatuan swasembada gitugitu     masuk lihat dalamnya ya kayak  beliau  wayang diatas prabowodanseni "
"1035","Negatif",-2," prabowodanseni   mengerti  wayang     budaya  budaya nusantara   paham  peran pewayangan    tengahtengah masyarakat  prabowodanseni "
"1036","Positif",1,"   kulit luarnya filosofi hidup  prabowo tu  bernegara kedaulatan persatuan swasembada gitugitu     masuk lihat dalamnya ya kayak  beliau  wayang diatas prabowodanseni "
"1037","Netral",0,"sbyfess mikirku ceklek ceklek ko ndi la gambar wayang"
"1038","Negatif",-6,"pencerah exanaklolina wayang haram hormat bendera haram lagu kebangsaan haram musik haram gk melu nduwe negoro ngatur ngatur    beragama      yg haram  yg halal"
